{
  "schema_version": "1.0.0",
  "id": "document-project-001",
  "title": "项目复盘草稿",
  "type": "project_doc",
  "project_id": "project-alpha",
  "markdown_uri": "crp://default/documents/project-alpha/document-project-001.md",
  "content_hash": "sha256:aaaaaaaaaaaaaaaaaaaaaaaaaaaaaaaaaaaaaaaaaaaaaaaaaaaaaaaaaaaaaaaa",
  "source_refs": [
    {
      "source_id": "source-text-001",
      "locator": "char:0-80"
    }
  ],
  "source_snapshot": {
    "snapshot_id": "snapshot-document-project-001-r1",
    "snapshot_hash": "sha256:bbbbbbbbbbbbbbbbbbbbbbbbbbbbbbbbbbbbbbbbbbbbbbbbbbbbbbbbbbbbbbbb",
    "source_refs": [
      {
        "source_id": "source-text-001",
        "locator": "char:0-80"
      }
    ],
    "captured_at": "2026-06-29T13:00:00+08:00"
  },
  "blocks": [
    {
      "id": "block-title",
      "block_type": "heading",
      "origin": "user",
      "content": "项目复盘草稿",
      "source_refs": [],
      "edited_by_user": true,
      "lock_policy": "user_edit_protected"
    },
    {
      "id": "block-summary",
      "block_type": "paragraph",
      "origin": "ai",
      "content": "本轮目标是建立可追溯的文档草稿。",
      "source_refs": [
        {
          "source_id": "source-text-001",
          "locator": "char:0-80"
        }
      ],
      "edited_by_user": false,
      "lock_policy": "source_required"
    }
  ],
  "revision": 1,
  "status": "draft",
  "created_at": "2026-06-29T13:00:00+08:00",
  "updated_at": "2026-06-29T13:00:00+08:00"
}
